{
  "run_id": "20260918T151403-P2_R5_VERIFY-5c33e797b918",
  "phase_id": "P2_R5_VERIFY",
  "started_at": "2026-09-18T15:14:03.624135+00:00",
  "finished_at": "2026-09-18T15:14:46.715360+00:00",
  "git_commit": "664af5f57781f618b0a90347c080914bac6c4339",
  "git_dirty": true,
  "preexisting_changes": [
    {
      "status": " D",
      "path": "redme.txt"
    }
  ],
  "preexisting_untracked": [],
  "commands": [
    {
      "id": "focal_tests",
      "argv": [
        "E:\\dino\\Dino\\.venv\\Scripts\\python.exe",
        "-c",
        "import unittest; patterns=['test_p2b*.py', 'test_gas1d.py', 'test_p2_fixes.py', 'test_p1_r2.py', 'test_p1_r3.py', 'test_p1_r4.py', 'test_p1_r4_gate.py', 'test_p1_r5*.py']; suite=unittest.TestSuite(unittest.defaultTestLoader.discover(\"tests\",pattern=p) for p in patterns); result=unittest.TextTestRunner(verbosity=2).run(suite); raise SystemExit(not result.wasSuccessful())"
      ],
      "kind": "test",
      "returncode": 0,
      "duration_seconds": 23.734000000171363,
      "status": "passed",
      "stdout_log": "logs/1-focal_tests.stdout.log",
      "stderr_log": "logs/1-focal_tests.stderr.log",
      "error": ""
    },
    {
      "id": "offline_closure",
      "argv": [
        "E:\\dino\\Dino\\.venv\\Scripts\\python.exe",
        "-m",
        "dev_orchestrator.p1_r5_close",
        "--run-dir",
        "E:\\dino\\Dino\\dev_orchestrator\\runs\\20260918T151403-P2_R5_VERIFY-5c33e797b918"
      ],
      "kind": "command",
      "returncode": 0,
      "duration_seconds": 12.264999999664724,
      "status": "passed",
      "stdout_log": "logs/1-offline_closure.stdout.log",
      "stderr_log": "logs/1-offline_closure.stderr.log",
      "error": ""
    }
  ],
  "checks": [
    {
      "id": "focal_tests",
      "passed": true,
      "kind": "test",
      "reason": "passed"
    },
    {
      "id": "offline_closure",
      "passed": true,
      "kind": "infrastructure",
      "reason": "passed"
    },
    {
      "id": "baseline_intact",
      "passed": true,
      "kind": "numerical",
      "reason": "P2_READY_FOR_FINAL_INDEPENDENT_REVIEW"
    },
    {
      "id": "contract_frozen",
      "passed": true,
      "kind": "numerical",
      "reason": "P2_READY_FOR_FINAL_INDEPENDENT_REVIEW"
    },
    {
      "id": "dependencies_accepted",
      "passed": true,
      "kind": "numerical",
      "reason": "P2_READY_FOR_FINAL_INDEPENDENT_REVIEW"
    },
    {
      "id": "first_order_contracts_frozen",
      "passed": true,
      "kind": "numerical",
      "reason": "P2_READY_FOR_FINAL_INDEPENDENT_REVIEW"
    },
    {
      "id": "p1_r4_accepted",
      "passed": true,
      "kind": "numerical",
      "reason": "P2_READY_FOR_FINAL_INDEPENDENT_REVIEW"
    },
    {
      "id": "p2a_accepted",
      "passed": true,
      "kind": "numerical",
      "reason": "P2_READY_FOR_FINAL_INDEPENDENT_REVIEW"
    },
    {
      "id": "FIRST_ORDER_R4",
      "passed": true,
      "kind": "numerical",
      "reason": "P2_READY_FOR_FINAL_INDEPENDENT_REVIEW"
    },
    {
      "id": "P0_regression",
      "passed": true,
      "kind": "numerical",
      "reason": "P2_READY_FOR_FINAL_INDEPENDENT_REVIEW"
    },
    {
      "id": "P2B",
      "passed": true,
      "kind": "numerical",
      "reason": "P2_READY_FOR_FINAL_INDEPENDENT_REVIEW"
    },
    {
      "id": "all_final",
      "passed": true,
      "kind": "numerical",
      "reason": "P2_READY_FOR_FINAL_INDEPENDENT_REVIEW"
    },
    {
      "id": "T12_ten",
      "passed": true,
      "kind": "numerical",
      "reason": "P2_READY_FOR_FINAL_INDEPENDENT_REVIEW"
    },
    {
      "id": "conservation",
      "passed": true,
      "kind": "numerical",
      "reason": "P2_READY_FOR_FINAL_INDEPENDENT_REVIEW"
    },
    {
      "id": "admissibility",
      "passed": true,
      "kind": "numerical",
      "reason": "P2_READY_FOR_FINAL_INDEPENDENT_REVIEW"
    },
    {
      "id": "solver_unchanged",
      "passed": true,
      "kind": "numerical",
      "reason": "P2_READY_FOR_FINAL_INDEPENDENT_REVIEW"
    }
  ],
  "tests": [
    {
      "id": "focal_tests",
      "argv": [
        "E:\\dino\\Dino\\.venv\\Scripts\\python.exe",
        "-c",
        "import unittest; patterns=['test_p2b*.py', 'test_gas1d.py', 'test_p2_fixes.py', 'test_p1_r2.py', 'test_p1_r3.py', 'test_p1_r4.py', 'test_p1_r4_gate.py', 'test_p1_r5*.py']; suite=unittest.TestSuite(unittest.defaultTestLoader.discover(\"tests\",pattern=p) for p in patterns); result=unittest.TextTestRunner(verbosity=2).run(suite); raise SystemExit(not result.wasSuccessful())"
      ],
      "kind": "test",
      "returncode": 0,
      "duration_seconds": 23.734000000171363,
      "status": "passed",
      "stdout_log": "logs/1-focal_tests.stdout.log",
      "stderr_log": "logs/1-focal_tests.stderr.log",
      "error": ""
    }
  ],
  "metrics": {
    "completed_cases": 58,
    "new_integrations": 0
  },
  "review": {
    "status": "BLOCKED",
    "findings": [
      "No hay reviewer independiente conectado."
    ],
    "blocking_findings": [
      "reviewer_unavailable"
    ],
    "scientific_change_required": false,
    "notes": "No se llamó a ningún proveedor externo.",
    "kind": "none"
  },
  "gate": "BLOCKED",
  "gate_reasons": [
    "review_not_approved"
  ],
  "execution_status": "COMPLETED",
  "attempts": [
    {
      "number": 1,
      "kind": "initial",
      "cause": "review_not_approved",
      "state": "BLOCKED"
    }
  ],
  "files_changed": [],
  "scope_violations": [],
  "preexisting_touched": [],
  "errors": [],
  "artifacts": [
    {
      "path": "artifacts/result.json",
      "sha256": "f029cdd3718347423a2f7ef05f4d4325458382e337e7e403becd2060b9ec0386",
      "bytes": 2294
    },
    {
      "path": "artifacts/closure.json",
      "sha256": "1da24aa9012a9271af940560fdb09e390d4d67bd0fd5c21fb636059e7de4bc6f",
      "bytes": 234928
    }
  ],
  "phase_definition_sha256": "6369636db870956b6f080a84edaa67c032ac85bc20429bff6be5a5f318e07fdd",
  "config": {
    "default_command_timeout": 30,
    "default_phase_timeout": 120,
    "default_max_repair_attempts": 3,
    "runs_directory": "dev_orchestrator/runs",
    "python_executable_policy": "current_interpreter",
    "reviewer_mode": "dummy_local",
    "dependency_evidence": {
      "P0": "docs\\gasdynamic\\p0_accepted_dependency.json",
      "P1_R4_CFL_REVIEW": "docs\\gasdynamic\\p1_r4_accepted_dependency.json",
      "P2A_R4_VERIFY": "docs\\gasdynamic\\p2a_accepted_dependency.json"
    }
  },
  "continue_requested": false
}
