{
  "run_id": "20260918T160102-P3-10dd93928879",
  "phase_id": "P3",
  "started_at": "2026-09-18T16:01:02.553803+00:00",
  "finished_at": "2026-09-18T16:02:08.345976+00:00",
  "git_commit": "3a19e41c826700d71e1375607beb437c385aef9e",
  "git_dirty": true,
  "preexisting_changes": [
    {
      "status": " D",
      "path": "redme.txt"
    }
  ],
  "preexisting_untracked": [],
  "commands": [
    {
      "id": "regression_tests",
      "argv": [
        "E:\\dino\\Dino\\.venv\\Scripts\\python.exe",
        "-c",
        "import unittest; patterns=['test_p2b*.py', 'test_gas1d.py', 'test_p2_fixes.py', 'test_p1_r2.py', 'test_p1_r3.py', 'test_p1_r4.py', 'test_p1_r4_gate.py', 'test_p1_r5*.py', 'test_coupling_preflight.py']; suite=unittest.TestSuite(unittest.defaultTestLoader.discover(\"tests\",pattern=p) for p in patterns); result=unittest.TextTestRunner(verbosity=2).run(suite); raise SystemExit(not result.wasSuccessful())"
      ],
      "kind": "test",
      "returncode": 0,
      "duration_seconds": 25.625,
      "status": "passed",
      "stdout_log": "logs/1-regression_tests.stdout.log",
      "stderr_log": "logs/1-regression_tests.stderr.log",
      "error": ""
    },
    {
      "id": "preflight",
      "argv": [
        "E:\\dino\\Dino\\.venv\\Scripts\\python.exe",
        "-m",
        "dev_orchestrator.p3_preflight",
        "--run-dir",
        "E:\\dino\\Dino\\dev_orchestrator\\runs\\20260918T160102-P3-10dd93928879"
      ],
      "kind": "command",
      "returncode": 0,
      "duration_seconds": 12.45299999974668,
      "status": "passed",
      "stdout_log": "logs/1-preflight.stdout.log",
      "stderr_log": "logs/1-preflight.stderr.log",
      "error": ""
    }
  ],
  "checks": [
    {
      "id": "regression_tests",
      "passed": true,
      "kind": "test",
      "reason": "passed"
    },
    {
      "id": "preflight",
      "passed": true,
      "kind": "infrastructure",
      "reason": "passed"
    },
    {
      "id": "P2_HUMAN_ACCEPTED",
      "passed": true,
      "kind": "numerical",
      "reason": "P3_BLOCKED_BACKFLOW"
    },
    {
      "id": "P2_frozen",
      "passed": true,
      "kind": "numerical",
      "reason": "P3_BLOCKED_BACKFLOW"
    },
    {
      "id": "P2_regression",
      "passed": true,
      "kind": "numerical",
      "reason": "P3_BLOCKED_BACKFLOW"
    },
    {
      "id": "P0_regression",
      "passed": true,
      "kind": "numerical",
      "reason": "P3_BLOCKED_BACKFLOW"
    },
    {
      "id": "reservoir_branch_exists_for_admissible_reversal",
      "passed": false,
      "kind": "numerical",
      "reason": "P3_BLOCKED_BACKFLOW"
    }
  ],
  "tests": [
    {
      "id": "regression_tests",
      "argv": [
        "E:\\dino\\Dino\\.venv\\Scripts\\python.exe",
        "-c",
        "import unittest; patterns=['test_p2b*.py', 'test_gas1d.py', 'test_p2_fixes.py', 'test_p1_r2.py', 'test_p1_r3.py', 'test_p1_r4.py', 'test_p1_r4_gate.py', 'test_p1_r5*.py', 'test_coupling_preflight.py']; suite=unittest.TestSuite(unittest.defaultTestLoader.discover(\"tests\",pattern=p) for p in patterns); result=unittest.TextTestRunner(verbosity=2).run(suite); raise SystemExit(not result.wasSuccessful())"
      ],
      "kind": "test",
      "returncode": 0,
      "duration_seconds": 25.625,
      "status": "passed",
      "stdout_log": "logs/1-regression_tests.stdout.log",
      "stderr_log": "logs/1-regression_tests.stderr.log",
      "error": ""
    }
  ],
  "metrics": {
    "evaluations": 42,
    "new_integrations": 0,
    "wall_seconds": 11.75
  },
  "review": {
    "status": "BLOCKED",
    "findings": [
      "No hay reviewer independiente conectado."
    ],
    "blocking_findings": [
      "reviewer_unavailable"
    ],
    "scientific_change_required": false,
    "notes": "No se llamó a ningún proveedor externo.",
    "kind": "none"
  },
  "gate": "SCIENTIFIC_CHANGE_REQUIRED",
  "gate_reasons": [
    "unauthorized_scientific_change_required"
  ],
  "execution_status": "COMPLETED",
  "attempts": [
    {
      "number": 1,
      "kind": "initial",
      "cause": "unauthorized_scientific_change_required",
      "state": "SCIENTIFIC_CHANGE_REQUIRED"
    }
  ],
  "files_changed": [],
  "scope_violations": [],
  "preexisting_touched": [],
  "errors": [],
  "artifacts": [],
  "phase_definition_sha256": "67fd415e956ec21899ccd038f3db2f3bfbaeb8d764381da120fb9230c31ebef7",
  "config": {
    "default_command_timeout": 30,
    "default_phase_timeout": 120,
    "default_max_repair_attempts": 3,
    "runs_directory": "dev_orchestrator/runs",
    "python_executable_policy": "current_interpreter",
    "reviewer_mode": "dummy_local",
    "dependency_evidence": {
      "P2": "docs\\gasdynamic\\p2_accepted_dependency.json"
    }
  },
  "continue_requested": false
}
